{
  "website": "mohito.com",
  "HOME_DELIVERY": {
    "available": "yes",
    "providers": [
      "PPL"
    ],
    "pricing": "99 Kč",
    "free_delivery_limit": "1200 Kč",
    "delivery_time": "2-5 pracovních dnů",
    "express_delivery": {
      "available": "yes",
      "delivery_time": "1-2 pracovních dnů (pro objednávky zadané do 12:00)",
      "pricing": "149 Kč"
    },
    "weekend_delivery": {
      "available": "not available",
      "days": "not available"
    },
    "island_surcharge": "not available",
    "cod_surcharge": "29 Kč"
  },
  "BULKY_PRODUCT_HOME_DELIVERY": {
    "available": "not available",
    "providers": [],
    "pricing": "not available",
    "free_delivery_limit": "not available",
    "delivery_time": "not available",
    "express_delivery": {
      "available": "not available",
      "delivery_time": "not available",
      "pricing": "not available"
    },
    "weekend_delivery": {
      "available": "not available",
      "days": "not available"
    },
    "island_surcharge": "not available",
    "cod_surcharge": "not available"
  },
  "PARCEL_SHOPS": {
    "available": "yes",
    "providers": [
      "Zásilkovna"
    ],
    "locations_count": "not available",
    "pricing": "69 Kč",
    "free_delivery_limit": "1200 Kč",
    "express_delivery": {
      "available": "not available",
      "delivery_time": "not available",
      "pricing": "not available"
    },
    "weekend_delivery": {
      "available": "not available",
      "days": "not available"
    },
    "island_surcharge": "not available",
    "cod_surcharge": "29 Kč"
  },
  "PARCEL_LOCKERS": {
    "available": "not available",
    "providers": [],
    "locations_count": "not available",
    "pricing": "not available",
    "free_delivery_limit": "not available",
    "express_delivery": {
      "available": "not available",
      "delivery_time": "not available",
      "pricing": "not available"
    },
    "weekend_delivery": {
      "available": "not available",
      "days": "not available"
    },
    "island_surcharge": "not available",
    "cod_surcharge": "not available"
  },
  "IN_STORE_PICKUP": {
    "available": "yes",
    "locations": "not available",
    "pricing": "Zdarma",
    "free_delivery_limit": "0 Kč",
    "express_delivery": {
      "available": "not available",
      "delivery_time": "not available",
      "pricing": "not available"
    },
    "weekend_delivery": {
      "available": "not available",
      "days": "not available"
    },
    "island_surcharge": "not available",
    "cod_surcharge": "not available"
  },
  "SUMMARY": "SUMMARY: Mohito.com in Czechia offers several delivery options: standard home delivery (PPL, 99 Kč, 2-5 days), express home delivery (PPL, 149 Kč, 1-2 days), delivery to Zásilkovna parcel shops (69 Kč, 2-5 days), and free in-store pickup (3-7 days). Free shipping is available for standard delivery and parcel shops on orders over 1200 Kč. \nNOTABLE FEATURES: A cash on delivery (COD) option is available for a 29 Kč surcharge for standard home delivery and parcel shop delivery. Express delivery is not available with COD. \nWEBSITE ASSESSMENT: The shipping information is clearly presented on a dedicated 'Doprava' page, detailing costs, times, and providers. Information on COD is located on a separate payment methods page. The site lacks details on weekend delivery, specific information for parcel lockers, or any surcharges for bulky items."
}