{
  "website": "motora.cz",
  "HOME_DELIVERY": {
    "available": "not available",
    "providers": [],
    "pricing": "not available",
    "free_delivery_limit": "not available",
    "delivery_time": "not available",
    "express_delivery": {
      "available": "not available",
      "delivery_time": "not available",
      "pricing": "not available"
    },
    "weekend_delivery": {
      "available": "not available",
      "days": "not available"
    },
    "island_surcharge": "not available",
    "cod_surcharge": "not available"
  },
  "BULKY_PRODUCT_HOME_DELIVERY": {
    "available": "not available",
    "providers": [],
    "pricing": "not available",
    "free_delivery_limit": "not available",
    "delivery_time": "not available",
    "express_delivery": {
      "available": "not available",
      "delivery_time": "not available",
      "pricing": "not available"
    },
    "weekend_delivery": {
      "available": "not available",
      "days": "not available"
    },
    "island_surcharge": "not available",
    "cod_surcharge": "not available"
  },
  "PARCEL_SHOPS": {
    "available": "not available",
    "providers": [],
    "locations_count": "not available",
    "pricing": "not available",
    "free_delivery_limit": "not available",
    "express_delivery": {
      "available": "not available",
      "delivery_time": "not available",
      "pricing": "not available"
    },
    "weekend_delivery": {
      "available": "not available",
      "days": "not available"
    },
    "island_surcharge": "not available",
    "cod_surcharge": "not available"
  },
  "PARCEL_LOCKERS": {
    "available": "not available",
    "providers": [],
    "locations_count": "not available",
    "pricing": "not available",
    "free_delivery_limit": "not available",
    "express_delivery": {
      "available": "not available",
      "delivery_time": "not available",
      "pricing": "not available"
    },
    "weekend_delivery": {
      "available": "not available",
      "days": "not available"
    },
    "island_surcharge": "not available",
    "cod_surcharge": "not available"
  },
  "IN_STORE_PICKUP": {
    "available": "yes",
    "locations": [
      "Brno - Komárov",
      "Brno - Chrlice",
      "Šumperk",
      "Třebíč"
    ],
    "pricing": "not available",
    "free_delivery_limit": "not available",
    "express_delivery": {
      "available": "not available",
      "delivery_time": "not available",
      "pricing": "not available"
    },
    "weekend_delivery": {
      "available": "no",
      "days": "not available"
    },
    "island_surcharge": "not available",
    "cod_surcharge": "not available"
  },
  "SUMMARY": "DELIVERY OPTIONS: The provided information only confirms the availability of in-store pickup. Details for home delivery, parcel shops, and parcel lockers are not available on the page. PRICING: No pricing information for any delivery method is available. PROVIDERS: No shipping providers are listed. NOTABLE FEATURES: In-store pickup is available at four locations: Brno - Komárov, Brno - Chrlice, Šumperk, and Třebíč. Pickups are only possible on weekdays; opening hours vary by location. No weekend pickup is available. WEBSITE ASSESSMENT: The provided webpage does not contain comprehensive shipping information, likely due to an IP restriction block. While it lists physical store locations, it lacks crucial details about delivery services, pricing, and providers, which are expected to be on a dedicated 'Poštovné' (Shipping) page."
}