{
  "website": "reserved.com",
  "HOME_DELIVERY": {
    "available": "yes",
    "providers": [
      "PPL"
    ],
    "pricing": "99 Kč",
    "free_delivery_limit": "1200 Kč",
    "delivery_time": "2-5 business days",
    "express_delivery": {
      "available": "no",
      "delivery_time": "not available",
      "pricing": "not available"
    },
    "weekend_delivery": {
      "available": "no",
      "days": "not available"
    },
    "island_surcharge": "not available",
    "cod_surcharge": "29 Kč"
  },
  "BULKY_PRODUCT_HOME_DELIVERY": {
    "available": "not available",
    "providers": [],
    "pricing": "not available",
    "free_delivery_limit": "not available",
    "delivery_time": "not available",
    "express_delivery": {
      "available": "not available",
      "delivery_time": "not available",
      "pricing": "not available"
    },
    "weekend_delivery": {
      "available": "not available",
      "days": "not available"
    },
    "island_surcharge": "not available",
    "cod_surcharge": "not available"
  },
  "PARCEL_SHOPS": {
    "available": "yes",
    "providers": [
      "Zásilkovna"
    ],
    "locations_count": "not available",
    "pricing": "69 Kč",
    "free_delivery_limit": "1200 Kč",
    "express_delivery": {
      "available": "no",
      "delivery_time": "not available",
      "pricing": "not available"
    },
    "weekend_delivery": {
      "available": "no",
      "days": "not available"
    },
    "island_surcharge": "not available",
    "cod_surcharge": "29 Kč"
  },
  "PARCEL_LOCKERS": {
    "available": "yes",
    "providers": [
      "Zásilkovna (Z-BOX)"
    ],
    "locations_count": "not available",
    "pricing": "69 Kč",
    "free_delivery_limit": "1200 Kč",
    "express_delivery": {
      "available": "no",
      "delivery_time": "not available",
      "pricing": "not available"
    },
    "weekend_delivery": {
      "available": "no",
      "days": "not available"
    },
    "island_surcharge": "not available",
    "cod_surcharge": "29 Kč"
  },
  "IN_STORE_PICKUP": {
    "available": "yes",
    "locations": "not available",
    "pricing": "Free",
    "free_delivery_limit": "not applicable",
    "express_delivery": {
      "available": "no",
      "delivery_time": "not available",
      "pricing": "not available"
    },
    "weekend_delivery": {
      "available": "no",
      "days": "not available"
    },
    "island_surcharge": "not available",
    "cod_surcharge": "not available"
  },
  "SUMMARY": "SUMMARY: Reserved.com in Czechia offers three delivery methods: Home Delivery via PPL, Parcel Shop/Locker delivery via Zásilkovna, and free In-Store Pickup. PRICING: Home delivery costs 99 Kč and Parcel Shop/Locker delivery costs 69 Kč. Free shipping is available for orders over 1200 Kč. A cash on delivery (COD) option incurs a 29 Kč surcharge. DELIVERY TIME: Standard delivery is estimated at 2-5 business days. NOTABLE FEATURES: The store uses established local carriers. The free shipping threshold of 1200 Kč applies to both home and parcel delivery. No express or weekend delivery options are mentioned, and there is no specific information regarding the shipment of bulky items. WEBSITE ASSESSMENT: The shipping information is clear, well-structured, and easy to locate. It provides essential details on costs, providers, and timelines, but lacks information on premium services like express delivery or special handling for large products."
}