{
  "website": "armed.cz",
  "HOME_DELIVERY": {
    "available": "yes",
    "providers": [
      "Česká pošta",
      "GLS"
    ],
    "pricing": "Česká pošta: 99 Kč, GLS: 99 Kč. Free shipping for orders over 2000 Kč.",
    "free_delivery_limit": "2000 Kč",
    "delivery_time": "Orders received by 12:00 on a business day are usually dispatched the same day. Orders received after 12:00 are dispatched the next business day. If goods are being transferred from branches, dispatch may take three business days.",
    "express_delivery": {
      "available": "not available",
      "delivery_time": "not available",
      "pricing": "not available"
    },
    "weekend_delivery": {
      "available": "not available",
      "days": "not available"
    },
    "island_surcharge": "not available",
    "cod_surcharge": "30 Kč"
  },
  "BULKY_PRODUCT_HOME_DELIVERY": {
    "available": "not available",
    "providers": [],
    "pricing": "not available",
    "free_delivery_limit": "not available",
    "delivery_time": "not available",
    "express_delivery": {
      "available": "not available",
      "delivery_time": "not available",
      "pricing": "not available"
    },
    "weekend_delivery": {
      "available": "not available",
      "days": "not available"
    },
    "island_surcharge": "not available",
    "cod_surcharge": "not available"
  },
  "PARCEL_SHOPS": {
    "available": "yes",
    "providers": [
      "Zásilkovna",
      "Balíkovna"
    ],
    "locations_count": "not available",
    "pricing": "Zásilkovna: 50 Kč, Balíkovna: 50 Kč. Free shipping for orders over 2000 Kč.",
    "free_delivery_limit": "2000 Kč",
    "express_delivery": {
      "available": "not available",
      "delivery_time": "not available",
      "pricing": "not available"
    },
    "weekend_delivery": {
      "available": "not available",
      "days": "not available"
    },
    "island_surcharge": "not available",
    "cod_surcharge": "30 Kč"
  },
  "PARCEL_LOCKERS": {
    "available": "yes",
    "providers": [
      "Zásilkovna",
      "Balíkovna"
    ],
    "locations_count": "not available",
    "pricing": "Zásilkovna: 50 Kč, Balíkovna: 50 Kč. Free shipping for orders over 2000 Kč.",
    "free_delivery_limit": "2000 Kč",
    "express_delivery": {
      "available": "not available",
      "delivery_time": "not available",
      "pricing": "not available"
    },
    "weekend_delivery": {
      "available": "not available",
      "days": "not available"
    },
    "island_surcharge": "not available",
    "cod_surcharge": "30 Kč"
  },
  "IN_STORE_PICKUP": {
    "available": "yes",
    "locations": [
      "Tábor",
      "Praha 9",
      "Vyškov",
      "Plzeň",
      "Brno",
      "Pardubice"
    ],
    "pricing": "zdarma",
    "free_delivery_limit": "not applicable",
    "express_delivery": {
      "available": "not available",
      "delivery_time": "not available",
      "pricing": "not available"
    },
    "weekend_delivery": {
      "available": "not available",
      "days": "not available"
    },
    "island_surcharge": "not available",
    "cod_surcharge": "30 Kč"
  },
  "SUMMARY": "DELIVERY OPTIONS: Armed.cz offers home delivery, parcel shop/locker delivery, and in-store pickup in the Czech Republic.\nPROVIDERS: Home delivery is handled by Česká pošta and GLS. Parcel points are available through Zásilkovna and Balíkovna. In-store pickup is available at six locations.\nPRICING: Home delivery costs 99 Kč. Parcel point delivery costs 50 Kč. In-store pickup is free. Shipping is free for all orders over 2000 Kč. The cash on delivery (COD) surcharge is 30 Kč.\nDELIVERY TIME: Orders for in-stock items are typically dispatched the same or next business day.\nNOTABLE FEATURES: Free shipping threshold at 2000 Kč. A network of six physical stores for free personal collection (Tábor, Praha 9, Vyškov, Plzeň, Brno, Pardubice). Simple and flat-rate pricing structure.\nWEBSITE ASSESSMENT: The shipping information is presented clearly and concisely on a dedicated page. The pricing is transparent and easy to understand with a simple table. The page lacks information on specific delivery timeframes (e.g., D+1), express delivery options, weekend delivery, and any details regarding bulky item shipping."
}