{
  "website": "argentum.hr",
  "HOME_DELIVERY": {
    "available": "yes",
    "providers": [
      "GLS",
      "Hrvatska pošta"
    ],
    "pricing": "3,90 € for GLS home delivery. Free for orders over 40,00 €.",
    "free_delivery_limit": "40,00 €",
    "delivery_time": "2-5 business days for mainland Croatia. For islands not on the specific delivery schedule, delivery is via Hrvatska pošta within 10 business days.",
    "express_delivery": {
      "available": "no",
      "delivery_time": "not available",
      "pricing": "not available"
    },
    "weekend_delivery": {
      "available": "no",
      "days": "not available"
    },
    "island_surcharge": "No monetary surcharge is mentioned, but delivery to islands has a specific schedule. For islands Krk, Cres, Lošinj, Rab, Murter, Korčula, Pelješac, Vir, Pag, Hvar, Brač, Vis, Pašman, and Ugljan, delivery is available on specific weekdays. For other islands, delivery is via Hrvatska pošta and takes up to 10 business days.",
    "cod_surcharge": "not available"
  },
  "BULKY_PRODUCT_HOME_DELIVERY": {
    "available": "no",
    "providers": [],
    "pricing": "not available",
    "free_delivery_limit": "not available",
    "delivery_time": "not available",
    "express_delivery": {
      "available": "not available",
      "delivery_time": "not available",
      "pricing": "not available"
    },
    "weekend_delivery": {
      "available": "not available",
      "days": "not available"
    },
    "island_surcharge": "not available",
    "cod_surcharge": "not available"
  },
  "PARCEL_SHOPS": {
    "available": "no",
    "providers": [],
    "locations_count": "not available",
    "pricing": "not available",
    "free_delivery_limit": "not available",
    "express_delivery": {
      "available": "not available",
      "delivery_time": "not available",
      "pricing": "not available"
    },
    "weekend_delivery": {
      "available": "not available",
      "days": "not available"
    },
    "island_surcharge": "not available",
    "cod_surcharge": "not available"
  },
  "PARCEL_LOCKERS": {
    "available": "yes",
    "providers": [
      "BOX NOW",
      "GLS"
    ],
    "locations_count": "not available",
    "pricing": "BOX NOW parcel locker: 2,00 €. GLS parcel locker: 2,00 €. Free for orders over 40,00 €.",
    "free_delivery_limit": "40,00 €",
    "express_delivery": {
      "available": "no",
      "delivery_time": "not available",
      "pricing": "not available"
    },
    "weekend_delivery": {
      "available": "no",
      "days": "not available"
    },
    "island_surcharge": "not available",
    "cod_surcharge": "not available"
  },
  "IN_STORE_PICKUP": {
    "available": "no",
    "locations": "not available",
    "pricing": "not available",
    "free_delivery_limit": "not available",
    "express_delivery": {
      "available": "not available",
      "delivery_time": "not available",
      "pricing": "not available"
    },
    "weekend_delivery": {
      "available": "not available",
      "days": "not available"
    },
    "island_surcharge": "not available",
    "cod_surcharge": "not available"
  },
  "SUMMARY": "DELIVERY OPTIONS: Argentum.hr offers home delivery and parcel locker delivery within Croatia. PROVIDERS: Delivery is handled by GLS, BOX NOW, and Hrvatska Pošta (for certain islands). PRICING: Home delivery costs 3,90 €, while parcel locker delivery is 2,00 €. Shipping is free for all orders exceeding 40,00 €. DELIVERY TIMES & RESTRICTIONS: Standard delivery time for mainland Croatia is 2-5 business days. Deliveries are not made on weekends. There is a specific weekly delivery schedule for major Croatian islands, and for other islands, delivery is via Hrvatska Pošta and can take up to 10 business days. NOTABLE FEATURES: Cash on delivery is offered as a payment method for home delivery, with no surcharge mentioned. The website provides a detailed table for island delivery schedules. WEBSITE ASSESSMENT: Shipping information is comprehensive but is located within the lengthy 'General Terms and Conditions' page, which can make it difficult for users to find quickly. A separate, easily accessible shipping information page would improve user experience. Information on express delivery and COD surcharges is not available."
}