{
  "website": "sudoper.hr",
  "HOME_DELIVERY": {
    "available": "yes",
    "providers": [
      "Hrvatska pošta",
      "Integralog",
      "GLS"
    ],
    "pricing": "Dostavu naručenih proizvoda Prodavatelj naplaćuje ovisno o cijeni proizvoda. Pored svakog je artikla napisan iznos cijene dostave, ali maksimanlni iznos dostave, bez obzira na količinu artikala iznosi 10,00 eura.",
    "free_delivery_limit": "not available",
    "delivery_time": "u okvirnom roku od tri radna dana",
    "express_delivery": {
      "available": "no",
      "delivery_time": "not available",
      "pricing": "not available"
    },
    "weekend_delivery": {
      "available": "no",
      "days": "not available"
    },
    "island_surcharge": "not available",
    "cod_surcharge": "not available"
  },
  "BULKY_PRODUCT_HOME_DELIVERY": {
    "available": "no",
    "providers": [],
    "pricing": "not available",
    "free_delivery_limit": "not available",
    "delivery_time": "not available",
    "express_delivery": {
      "available": "not available",
      "delivery_time": "not available",
      "pricing": "not available"
    },
    "weekend_delivery": {
      "available": "not available",
      "days": "not available"
    },
    "island_surcharge": "not available",
    "cod_surcharge": "not available"
  },
  "PARCEL_SHOPS": {
    "available": "no",
    "providers": [],
    "locations_count": "not available",
    "pricing": "not available",
    "free_delivery_limit": "not available",
    "express_delivery": {
      "available": "not available",
      "delivery_time": "not available",
      "pricing": "not available"
    },
    "weekend_delivery": {
      "available": "not available",
      "days": "not available"
    },
    "island_surcharge": "not available",
    "cod_surcharge": "not available"
  },
  "PARCEL_LOCKERS": {
    "available": "no",
    "providers": [],
    "locations_count": "not available",
    "pricing": "not available",
    "free_delivery_limit": "not available",
    "express_delivery": {
      "available": "not available",
      "delivery_time": "not available",
      "pricing": "not available"
    },
    "weekend_delivery": {
      "available": "not available",
      "days": "not available"
    },
    "island_surcharge": "not available",
    "cod_surcharge": "not available"
  },
  "IN_STORE_PICKUP": {
    "available": "no",
    "locations": "not available",
    "pricing": "not available",
    "free_delivery_limit": "not available",
    "express_delivery": {
      "available": "not available",
      "delivery_time": "not available",
      "pricing": "not available"
    },
    "weekend_delivery": {
      "available": "not available",
      "days": "not available"
    },
    "island_surcharge": "not available",
    "cod_surcharge": "not available"
  },
  "SUMMARY": "Sudoper.hr provides home delivery within Croatia and Slovenia via Hrvatska pošta, Integralog, and GLS. The delivery cost is specified for each product, with a maximum charge of €10.00 per order. The estimated delivery time is approximately 3 working days. NOTABLE FEATURES: Delivery is made only to the entrance of the residential building. There is no mention of free shipping, island surcharges, or cash on delivery. Express and weekend delivery are not available. WEBSITE ASSESSMENT: The shipping information is presented on a dedicated page and is easy to understand, but it lacks detail on several common delivery aspects such as island delivery, COD, and alternative pickup options like parcel shops or in-store pickup."
}